### ISSUE TITLE
Incorrect SNI is used when (reverse) proxying

### ISSUE THREAD

**Issue by deliciouslytyped** [mitmproxy/mitmproxy#7534]
#### Problem Description
Mitmproxy appears to use the wrong SNI when reverse proxying, leading to the TLS server not being able to determine the vhost/certificate to use. This is just what I run into, I haven't isolated the issue. I'm not sure if this is special curl behavior or mitmproxy is behaving incorrectly.

This can be a problem if using something like Caddy for TLS, and the curl client will give an error like `curl: (35) OpenSSL/3.0.13: error:0A000438:SSL routines::tlsv1 alert internal error` (the `tlsv1 alert internal error` is what seems to come from Caddy) (looks like `OpenSSL Error([('SSL routines', '', 'tlsv1 alert internal error')])  ` in mitmproxy)) if the Caddy server doesn't have a TLS certificate for the given SNI (because the SNI is wrong).

The only related issue I found so far is #6143 / #6148, but that's already in 10.0.0 and I'm running 11.0.2.
The symptoms seem to be very similar.

#### Steps to reproduce the behavior:
This will reproduce the behavior, not the error.

1. start a tls/http server; `ncat -v -k -l --ssl localhost 7777 -v -c 'printf "HTTP/1.1 200 pls\n\nfoo\n"'`
2. start mitmproxy; `mitmproxy -k --mode reverse:localhost:7777 -p 7776`
3. start termshark to capture packets; `termshark -i lo "port 7776 or port 7777"`. 
4. make a request; `curl -v -k https://asdf:7777 --connect-to asdf:7777:localhost:7776 -H "X-mytime: $(date)"`

In this repro the request will complete successfully (albeit I dont know if this is strictly correct HTTP, but it's beside the point), but the packet capture will show:
```
 7      0.001968562      127.0.0.1     127.0.0.1     TLSv1     583        Client Hello (SNI=asdf)
[+] Transmission Control Protocol, Src Port: 45158, Dst Port: 7776, Seq: 1, Ack: 1, Len: 517
...
 9      0.003887673      127.0.0.1     127.0.0.1     TLSv1.2   397        Client Hello (SNI=localhost)
[+] Transmission Control Protocol, Src Port: 36468, Dst Port: 7777, Seq: 1, Ack: 1, Len: 331
```
\- showing that
1. curl connects to mitmproxy running on port 7776 with sni of asdf
2. mitmproxy connects to the ncat server on port 7777 with sni of localhost

Here's debug output of the beginning, I hope containing and showing the problem:
```
[nix-shell:~]# mitmdump --set proxy_debug -k --mode reverse:localhost:7777 -p 7776 -v
[20:45:00.515] Initializing UDP server ...
[20:45:00.515] UDP server listening on 0.0.0.0:7776 ...
[20:45:00.516] UDP server successfully initialized.
[20:45:00.516] Initializing UDP server ..
[20:45:00.516] UDP server listening on [::]:7776 ...
[20:45:00.517] UDP server successfully initialized.
[20:45:00.517] reverse proxy to localhost:7777 listening at *:7776.
[20:45:01.904][127.0.0.1:40786] client connect
[20:45:01.904][127.0.0.1:40786]   >> Start({})
[20:45:01.904][127.0.0.1:40786]   << OpenConnection({'connection': Server({'id': '…dee39b', 'address': ('localhost', 7777), 'sni': 'localhost'})})                                                                 [20:45:01.905][127.0.0.1:40786]   >! DataReceived(client, b"\x16\x03\x01\x02\x00\x01\x00\x01\xfc\x03\x03\x0f^\xba\xec?...\x00")                
[20:45:01.906][127.0.0.1:40786] server connect localhost:7777 (127.0.0.1:7777)
[20:45:01.906][127.0.0.1:40786]   >> Reply(OpenConnection({'connection': Server({'id': '…dee39b', 'address': ('localhost', 7777), 'peername': ('127.0.0.1', 7777), 'sockname': ('127.0.0.1', 38496), 'state': <ConnectionState.OPEN: 3>, 'sni': 'localhost', 'timestamp_start': 1738698301.9051046, 'timestamp_tcp_setup': 1738698301.9065278})}), None)
[20:45:01.906][127.0.0.1:40786]     >> Start({})
[20:45:01.907][127.0.0.1:40786]   !> DataReceived(client, b"\x16\...\x00")
[20:45:01.907][127.0.0.1:40786]     >> DataReceived(client, b"\x16\...x00")
[20:45:01.907][127.0.0.1:40786]     << NextLayerHook(data=NextLayer:None)
[20:45:01.907][127.0.0.1:40786]   << NextLayerHook(data=NextLayer:None)
[20:45:01.908][127.0.0.1:40786]   >> Reply(NextLayerHook(data=NextLayer:ServerTLSLayer(inactive 'localhost' None)), None)
[20:45:01.908][127.0.0.1:40786]     >> Reply(NextLayerHook(data=NextLayer:ServerTLSLayer(inactive 'localhost' None)), None)
[20:45:01.908][127.0.0.1:40786]     [nextlayer] ServerTLSLayer(inactive 'localhost' None)
[20:45:01.908][127.0.0.1:40786]     >> Start({})
[20:45:01.908][127.0.0.1:40786]       >> Start({})
[20:45:01.908][127.0.0.1:40786]     >> DataReceived(client, b"\x16.…
[20:45:01.909][127.0.0.1:40786]       << TlsClienthelloHook(data=ClientHelloData(context=Context(
        Client({'id': '…1da7db', 'address': None, 'peername': ('127.0.0.1', 40786), 'sockname': ('127.0.0.1', 7776), 'state': <ConnectionState.OPEN: 3>, 'tls': True, 'alpn_offers': [b'h2', b'http/1.1'], 'sni': 'asdf', 'timestamp_start': 1738698301.9039338, 'proxy_mode': ProxyMode.parse('reverse:localhost:7777')}),
        Server({'id': '…dee39b', 'address': ('localhost', 7777), 'peername': ('127.0.0.1', 7777), 'sockname': ('127.0.0.1', 38496), 'state': <ConnectionState.OPEN: 3>, 'tls': True, 'sni': 'localhost', 'timestamp_start': 1738698301.9051046, 'timestamp_tcp_setup': 1738698301.9065278}),
        layers=[[ReverseProxy(state: handle_event), ServerTLSLayer(closed 'localhost' None), ClientTLSLayer(establishing 'asdf' None), HttpLayer(transparent, conns: 0)]]
      ), client_hello=ClientHello(sni: asdf, alpn_protocols: [b'h2', b'http/1.1']), ignore_connection=False, establish_server_tls_first=False))
```

#### System Information
```
mitmproxy --version
Mitmproxy: 11.0.2
Python:    3.12.8
OpenSSL:   OpenSSL 3.3.2 3 Sep 2024
Platform:  Linux-6.8.4-3-pve-x86_64-with-glibc2.40
```

**Comment by mhils** [comment]
Does this reproduce with 11.1?

**Comment by deliciouslytyped** [comment]
I can try to repro with 11.1 in a bit, but:

I don't quite understand this but I think this might be what's going on:
https://docs.mitmproxy.org/stable/concepts-modes/
```
Host Header

In reverse proxy mode, mitmproxy automatically rewrites the Host header to match the
upstream server. This allows mitmproxy to easily connect to existing endpoints on the 
open web (e.g. mitmproxy --mode reverse:https://example.com). You can disable this 
behaviour with the keep_host_header option.
```

`mitmdump --set keep_host_header` appears to work.

Is this a workaround or 100% the correct solution?

I started digging around the code and looking at values with pudb and an sni variable first appears to be set incorrectly here:
https://github.com/mitmproxy/mitmproxy/blob/385800f07ff31041c0d1394a5cf1bb8b016ef401/mitmproxy/proxy/layers/modes.py#L74-L78
and among a few other places, this also seems relevant:
https://github.com/mitmproxy/mitmproxy/blob/385800f07ff31041c0d1394a5cf1bb8b016ef401/mitmproxy/proxy/layers/http/__init__.py#L1117-L1121

**Comment by mhils** [comment]
I didn't read your initial post in detail because of the version. mitmproxy adjusting the SNI to whatever the target is by default is working as intended, and `keep_host_header` is the correct switch to change that. I'll make a note to make this clearer in the docs, thanks!

**Comment by deliciouslytyped** [comment]
Thanks!

In the meantime, I figured out I can easily run different versions of things with uvx, so here's the repro-ish anyway. ;) (with my original test environment, not the simplified one)

```
# uvx --from mitmproxy@11.1.0 mitmdump -vv -k --mode reverse:localhost:444 -p 443
[00:25:55.394] Initializing UDP server ...
[00:25:55.394] UDP server listening on 0.0.0.0:443 ...
[00:25:55.395] UDP server successfully initialized.
[00:25:55.395] Initializing UDP server ...
[00:25:55.395] UDP server listening on [::]:443 ...
[00:25:55.395] UDP server successfully initialized.
[00:25:55.396] reverse proxy to localhost:444 listening at *:443.
[00:25:58.036][127.0.0.1:60064] client connect
[00:25:58.038][127.0.0.1:60064] server connect localhost:444 (127.0.0.1:444)
[00:25:58.050][127.0.0.1:60064] Server TLS handshake failed. OpenSSL Error([('SSL routines', '', 'tlsv1 alert internal error')])
[00:25:58.051][127.0.0.1:60064] Unable to establish TLS connection with server (OpenSSL Error([('SSL routines', '', 'tlsv1 alert internal error')])). Trying to establish TLS with client anyway. If you plan to redirect requests away from this server, consider setting `connection_strategy` to `lazy` to suppress early connections.
[00:25:58.057][127.0.0.1:60064] server disconnect localhost:444 (127.0.0.1:444)
127.0.0.1:60064: GET https://localhost:444/ HTTP/2.0
    user-agent: curl/7.88.1
    accept: */*
 << OpenSSL Error([('SSL routines', '', 'tlsv1 alert internal error')])
[00:25:58.062][127.0.0.1:60064] client disconnect
```

**Comment by deliciouslytyped** [comment]
It is of course best if one reads the docs, is it warranted to do something for this that may be more visible when one isn't reading the docs? - or is this one of those innumerable obscure issues that there would be too many of to individually accommodate? 

Like a warning or something?
I don't imagine the --reverse docstring would be a good place for this.
And the reverse proxy documentation section isn't that long, if one things to check it.

**Comment by mhils** [comment]
We could conceivably write an addon that hooks https://docs.mitmproxy.org/stable/api/events.html#TLSEvents.tls_failed_server and https://docs.mitmproxy.org/stable/api/events.html#TLSEvents.tls_established_server.

1. If `tls_data.context.client.proxy_mode in self.seen`, we are done.
2. If it's a failure and we're in reverse proxy mode, we emit a log message (level: alert) pointing to `keep_host_header`. 
3. We add `tls_data.context.client.proxy_mode` to `self.seen` so that we don't spam the log.

Ideally we do the same for plain HTTP. This is a bit more tricky as there are multiple possible responses:
- Google returns a 404
- Cloudflare returns a 409
- Meta (facebook.com) a 301 redirecting to the target domain
- pypi.org (Fastly) does HTTP 500 Domain not found

Contributions would be highly welcome! It's probably best to start with the TLS bits only.
