### DISCUSSION TITLE
reply without remote server connection

### DISCUSSION THREAD

**Discussion by rayjanoka** [mitmproxy/mitmproxy#6058] [General]
Hi, I'm running in reverse-proxy mode, and I have a `request` hook setup to respond like this. I don't need anything from the remote server for this request.

```
"""Send a reply from the proxy without sending any data to the remote server."""
from mitmproxy import http

def request(flow: http.HTTPFlow) -> None:
    if flow.request.pretty_url == "http://example.com/path":
        flow.response = http.Response.make(
            200,  # (optional) status code
            b"Hello World",  # (optional) content
            {"Content-Type": "text/html"},  # (optional) headers
        )
```

It responds, but I still see a lot of IP traffic to the remote server. Maybe it is just setting up and shutting down the ssl connection? 

<details>
<summary>Packet Capture Summary</summary>

```
  353 550.006168440 240.0.21.241 → 13.107.237.40 TCP 74 47812 → 443 [SYN] Seq=0 Win=42300 Len=0 MSS=1410 SACK_PERM=1 TSval=1240887295 TSecr=0 WS=256
  354 550.006590694 13.107.237.40 → 240.0.21.241 TCP 74 443 → 47812 [SYN, ACK] Seq=0 Ack=1 Win=65535 Len=0 MSS=1410 SACK_PERM=1 TSval=2194501030 TSecr=1240887295 WS=2048
  355 550.006642992 240.0.21.241 → 13.107.237.40 TCP 66 47812 → 443 [ACK] Seq=1 Ack=1 Win=42496 Len=0 TSval=1240887296 TSecr=2194501030
  356 550.009700030 240.0.21.241 → 13.107.237.40 TLSv1 388 Client Hello
  357 550.010208110 13.107.237.40 → 240.0.21.241 TCP 66 443 → 47812 [ACK] Seq=1 Ack=323 Win=67584 Len=0 TSval=2194501033 TSecr=1240887299
  358 550.010419452 13.107.237.40 → 240.0.21.241 TLSv1.2 4162 Server Hello
  359 550.010450524 240.0.21.241 → 13.107.237.40 TCP 66 47812 → 443 [ACK] Seq=323 Ack=4097 Win=40960 Len=0 TSval=1240887300 TSecr=2194501033
  360 550.011511702 13.107.237.40 → 240.0.21.241 TLSv1.2 826 Certificate, Server Key Exchange, Server Hello Done
  361 550.011548230 240.0.21.241 → 13.107.237.40 TCP 66 47812 → 443 [ACK] Seq=323 Ack=4857 Win=42496 Len=0 TSval=1240887301 TSecr=2194501034
  362 550.016789273 240.0.21.241 → 13.107.237.40 TLSv1.2 192 Client Key Exchange, Change Cipher Spec, Encrypted Handshake Message
  363 550.017504167 13.107.237.40 → 240.0.21.241 TLSv1.2 117 Change Cipher Spec, Encrypted Handshake Message
  364 550.031615904 240.0.21.241 → 13.107.237.40 TCP 66 47812 → 443 [FIN, ACK] Seq=449 Ack=4908 Win=42496 Len=0 TSval=1240887321 TSecr=2194501040
  365 550.032302989 13.107.237.40 → 240.0.21.241 TCP 66 443 → 47812 [FIN, ACK] Seq=4908 Ack=450 Win=67584 Len=0 TSval=2194501055 TSecr=1240887321
  366 550.032357458 240.0.21.241 → 13.107.237.40 TCP 66 47812 → 443 [ACK] Seq=450 Ack=4909 Win=42496 Len=0 TSval=1240887321 TSecr=2194501055
  ```
</details>

Can I stop it from making the remote server connection altogether for these specific requests?

**Comment by rayjanoka** [comment]
I found this guy, I think this is going to get me what I'm after.

```python
--set connection_strategy=lazy
```

**Reply by rayjanoka** [reply]
We tried to setup a liveness/readiness probe for k8s pods via the `request()` webhook, and it was working but were having occasional single probe timeouts. It seems like sometimes the duration to setup the tls connection to our remote server was more than 1 second slowing down the static response and causing the probe to timeout.

```python
def request(flow: http.HTTPFlow) -> None:
    if flow.request.path == "/healthz":
        flow.response = http.Response.make(
            200, b"ok", {"Content-Type": "text/html"}
        )
```
