### ISSUE TITLE
simplest git commands on github fail miserably with TLS errors

### ISSUE THREAD

**Issue by pkit** [mitmproxy/mitmproxy#5575]
#### Problem Description

```
$ export GIT_CURL_VERBOSE=1
$ git ls-remote https://github.com/actions/runner HEAD
* Couldn't find host github.com in the .netrc file; using defaults
*   Trying 140.82.121.4:443...
* TCP_NODELAY set
* Connected to github.com (140.82.121.4) port 443 (#0)
* found 384 certificates in /etc/ssl/certs
* ALPN, offering h2
* ALPN, offering http/1.1
* SSL connection using TLS1.3 / ECDHE_RSA_AES_256_GCM_SHA384
* 	 server certificate verification OK
* 	 server certificate status verification SKIPPED
* 	 common name: github.com (matched)
* 	 server certificate expiration date OK
* 	 server certificate activation date OK
* 	 certificate public key: RSA
* 	 certificate version: #3
* 	 subject: CN=github.com
* 	 start date: Wed, 07 Sep 2022 18:34:58 GMT
* 	 expire date: Sat, 09 Sep 2023 18:34:58 GMT
* 	 issuer: CN=mitmproxy,O=mitmproxy
* ALPN, server accepted to use http/1.1
> GET /actions/runner/info/refs?service=git-upload-pack HTTP/1.1
Host: github.com
User-Agent: git/2.25.1
Accept: */*
Accept-Encoding: deflate, gzip, br
Accept-Language: C, *;q=0.9
Pragma: no-cache

* Mark bundle as not supporting multiuse
< HTTP/1.1 200 OK
< server: GitHub Babel 2.0
< content-type: application/x-git-upload-pack-advertisement
< content-security-policy: default-src 'none'; sandbox
< expires: Fri, 01 Jan 1980 00:00:00 GMT
< pragma: no-cache
< cache-control: no-cache, max-age=0, must-revalidate
< vary: Accept-Encoding
< x-frame-options: DENY
< x-github-request-id: B626:62A0:4930BEF:4B0852F:631B8D0D
* no chunk, no close, no size. Assume close to signal end
< 
* GnuTLS recv error (-110): The TLS connection was non-properly terminated.
* Closing connection 0
fatal: unable to access 'https://github.com/actions/runner/': GnuTLS recv error (-110): The TLS connection was non-properly terminated.
```
As you can see the cert is correctly picked up.

#### System Information
```
Mitmproxy: 8.1.1 binary
Python:    3.10.5
OpenSSL:   OpenSSL 3.0.3 3 May 2022
Platform:  Linux-5.4.0-125-generic-x86_64-with-glibc2.31
```

**Comment by mhils** [comment]
Just from the logs it seems like GnuTLS is really adamant on us properly shutting down the TLS connection and not just sending a TCP FIN. (I haven't tested this theory yet)

https://github.com/mitmproxy/mitmproxy/blob/57c71ea5bcb9d6e761ed7fbe6ab84915c8c5c97d/mitmproxy/proxy/layers/tls.py#L441-L443

**Comment by pkit** [comment]
Hmm, looks like doing
```python
        self.tls.unwrap()
        yield from super().send_close(half_close)
```
indeed solves it immediately.

**Comment by mhils** [comment]
There shouldn't exist an `unwrap()` method on the tls object. Is this just working because it actually errors now? 😅

**Comment by pkit** [comment]
Nope it's a success, and as far as I can see the method is there. 😆

**Comment by pkit** [comment]
Pretty strange behavior, it looks like it depends on a system. One test fails another one succeeds.
I cannot reproduce it now on my dev machine (i.e. code from `master` branch works, with no changes), but can on a new VM (kvm).

**Comment by pkit** [comment]
Aha, here we go.
Works:
```
Mitmproxy: 9.0.0.dev (+86, commit 57c71ea)
Python:    3.9.14
OpenSSL:   OpenSSL 3.0.5 5 Jul 2022
Platform:  Linux-5.15.0-46-generic-x86_64-with-glibc2.31
```
Fails with `GnuTLS recv error`:
```
Mitmproxy: 9.0.0.dev (+86, commit 57c71ea)
Python:    3.9.5
OpenSSL:   OpenSSL 3.0.5 5 Jul 2022
Platform:  Linux-5.4.0-125-generic-x86_64-with-glibc2.31
```

**Comment by pkit** [comment]
Okay, changed it to match on both, still the same behavior.
KVM guest - fails, KVM host - works.
There's something fishy on connection close:
Works:
```
17:14:03.444624 IP my-host.51586 > lb-140-82-121-3-fra.github.com.https: Flags [F.], seq 738, ack 86095, win 1256, options [nop,nop,TS val 460701096 ecr 2540422650], length 0
17:14:03.460145 IP lb-140-82-121-3-fra.github.com.https > my-host.51586: Flags [.], ack 738, win 67, options [nop,nop,TS val 2540422670 ecr 460701093], length 0
17:14:03.463822 IP lb-140-82-121-3-fra.github.com.https > my-host.51586: Flags [F.], seq 86095, ack 739, win 67, options [nop,nop,TS val 2540422674 ecr 460701096], length 0
17:14:03.463843 IP my-host.51586 > lb-140-82-121-3-fra.github.com.https: Flags [.], ack 86096, win 1256, options [nop,nop,TS val 460701116 ecr 2540422674], length 0
```
Fails:
```
15:12:04.591568 IP guest1.33342 > lb-140-82-121-3-fra.github.com.https: Flags [F.], seq 735, ack 85949, win 1125, options [nop,nop,TS val 3391806306 ecr 472112699], length 0
15:12:04.612594 IP lb-140-82-121-3-fra.github.com.https > guest1.33342: Flags [F.], seq 85949, ack 736, win 67, options [nop,nop,TS val 472112723 ecr 3391806304], length 0
15:12:04.612623 IP guest1.33342 > lb-140-82-121-3-fra.github.com.https: Flags [.], ack 85950, win 1125, options [nop,nop,TS val 3391806327 ecr 472112723], length 0
```

**Comment by mhils** [comment]
> Nope it's a success, and as far as I can see the method is there. 😆

That would be very surprising - we use PyOpenSSL, and its `OpenSSL.SSL.Connection` does not have an unwrap method. The corresponding API would be `Connection.shutdown` I think. 

Completely untested:
```python
 def send_close(self, half_close: bool) -> layer.CommandGenerator[None]: 
     self.tls.shutdown()
     yield from self.tls_interact()
     yield from super().send_close(half_close) 
```

**Comment by mhils** [comment]
I suspect it's some OS/networking difference? Most stacks make no distinction on whether a TLS connection is properly shutdown or whether the underlying TCP socket is shutdown (or reset). GnuTLS is the first example I see that actually cares (which is why we only implemented TCP-level hard shutdown so far).

**Comment by pkit** [comment]
The only difference right now is that it works on `Ubuntu` host and fails on the same `Ubuntu` but as kvm guest.
While all other stuff is the same right now: OpenSSL, kernel, python version all exactly the same.
